{"contract": "stepmeld/workflow.v1", "id": "x", "definition": {"name": "r", "version": 1}, "created": {"at": "2026-10-06T00:00:00Z", "by": {"kind": "person", "id": "max"}}, "steps": {"a": {"definition": {"name": "v", "version": 1}, "done_by": "performer", "inputs": {}, "parameters": {}, "outputs": {}, "policy": {}, "runs": [{"id": "x/a/1", "number": 1, "inputs": {}, "parameters": {}, "performer": "p", "started": {"at": "t", "by": {"kind": "person", "id": "max"}}, "outcome": {"state": "finished"}}]}}}
